Title,Image,lnz_URL,tbj
,https://i.pinimg.com/236x/17/d0/74/17d074b7f5c1b3f080804c0d40bbea42.jpg,https://www.pinterest.com/pin/68738738671/,Tim Gunn Essentials Classic minimal
Wardrobe essentials: which basics do you absolutely need to have in your closet?,https://i.pinimg.com/236x/4e/2c/54/4e2c54e2aae3d22967f226c20ef44abf.jpg,https://www.pinterest.com/pin/123919427239474918/,
Tim Gunn's Jewelry Tips,https://i.pinimg.com/236x/8a/97/69/8a9769d92cb56227cc70e09ca1025467.jpg,https://www.pinterest.com/pin/609463762090150229/,
Fashion Fridays - Getting Lucky with Tim Gunn - 303 Magazine,https://i.pinimg.com/236x/fa/52/ba/fa52ba74bb44cab1f61da0f6657ee5f7--tim-gunn-man-men.jpg,https://www.pinterest.com/pin/371195194300437034/,"Tim Gunn, although not a designer himself, is so good at nuturing creative new designers!! Love him!"
Tour Fashion Icon Tim Gunn's NYC Apartment for a Lesson in Classic Style,https://i.pinimg.com/236x/52/d0/d3/52d0d378781d772034894cab6361410c--new-york-homes-new-york-apartments.jpg,https://www.pinterest.com/pin/450922981445539233/,Fashion Guru Tim Gunn's Elegant New York Apartment Is a Lesson in Classic Style
,https://i.pinimg.com/236x/0e/1f/9e/0e1f9e0038452a76357c9997d35e20c8--style-guides-tim-gunn.jpg,https://www.pinterest.com/pin/633387438409437/,
Luxury fashion & independent designers | SSENSE,https://i.pinimg.com/236x/b7/60/cf/b760cfe6108724ace859bbc6bfeb7bba---essentials-minimalist-wardrobe.jpg,https://www.pinterest.com/pin/299841287698989853/,
Tim Gunn's Favorite Things,https://i.pinimg.com/236x/45/b0/e2/45b0e280f814c8f0a58a55d18202589c.jpg,https://www.pinterest.com/pin/427138345926711167/,Tim Gunn. Homosexual/Asexual interpretation of dandyism through masculinity. 20th century. Retrieved from ELLE Decor.
Project Runway’s Top Gunn,https://i.pinimg.com/236x/e5/8f/de/e58fde2985aa0a3bd3974d45d4f64f12.jpg,https://www.pinterest.com/pin/986358755866712401/,
,https://i.pinimg.com/236x/54/25/cf/5425cfce23186cc75c70399591bcd861--tim-gunn-quotes-hems.jpg,https://www.pinterest.com/pin/914862404719566/,TIm Gunn is pretty much my favorite ever!
Wardrobe Basics Checklist,https://i.pinimg.com/236x/82/81/14/828114b81a1a1b7f84bbdca6df2985a7.jpg,https://www.pinterest.com/pin/341710690496107504/,The One Thing Tim Gunn Recommends for Finding Your Own Personal Style | This simple trick will help you hone your look.
Going For The Gunn,https://i.pinimg.com/236x/e8/29/c7/e829c749ecf6b866a47051768cf68656--work-wardrobe-essentials-wardrobe-basics.jpg,https://www.pinterest.com/pin/311803974213397902/,
How Tim Gunn Makes It Work,https://i.pinimg.com/236x/eb/f8/0d/ebf80de37a52fa1d541e0b83dab86a1b--tim-gunn-reality-tv-stars.jpg,https://www.pinterest.com/pin/257338566185520916/,"The more I learn about Tim Gunn, the more I like him."
,https://i.pinimg.com/236x/6b/fc/e6/6bfce6d92b357cd085e13b6f4ac5f98f.jpg,https://www.pinterest.com/pin/296745062941530340/,Tim Gunn’s wardrobe essentials with my edits. 😀
,https://i.pinimg.com/236x/40/00/f9/4000f92787f96342a67a1359c82f6a93--quotes-on-life-book-quotes.jpg,https://www.pinterest.com/pin/281543701001952/,Tim Gunn...you would be like one of the best Dads ever!
,https://i.pinimg.com/236x/58/04/84/580484ef6a0284fb61144700729f4aa8--tim-gunn-project-runway.jpg,https://www.pinterest.com/pin/914862404719567/,Tim Gunn
,https://i.pinimg.com/236x/1f/e4/58/1fe458835015892e831b7e052bfd0dfe--tim-gunn-project-runway.jpg,https://www.pinterest.com/pin/54535845457398608/,Tim Gunn
Tim Gunn Talks Holiday Trends and Life After “Project Runway”,https://i.pinimg.com/236x/cf/86/d4/cf86d4491e117cb381b28ec555894633.jpg,https://www.pinterest.com/pin/692358142737536835/,"Tim Gunn Talks Holiday Trends and Life After ""Project Runway"""
currently link up | what would tim gunn do?,https://i.pinimg.com/236x/14/86/b0/1486b05c1bb34f9b7d124a4427ee8d8b--tim-gunn-what-would.jpg,https://www.pinterest.com/pin/439241769923335439/,
,https://i.pinimg.com/236x/c6/2e/89/c62e89908ef80b37d06d28fb61c470bd--tim-gunn-ask-me.jpg,https://www.pinterest.com/pin/260645897176260888/,
,https://i.pinimg.com/236x/38/85/d5/3885d5b72954560c7c2d6a746afa104f--camo-suit-tim-gunn.jpg,https://www.pinterest.com/pin/9781324164471738/,Tim Gunn in a camo suit...still makin' it work!
Why We All Need A Little Bit Of Tim Gunn In Our Lives,https://i.pinimg.com/236x/28/0c/aa/280caa5b61e964081cfcba55754c2cb0--tim-gunn-project-runway.jpg,https://www.pinterest.com/pin/360076932723155090/,Why We All Need A Little Bit Of Tim Gunn In Our Lives
The Seventeen Films That Shaped Tim Gunn - Slideshow - Vulture,https://i.pinimg.com/236x/43/16/2e/43162ecbff23f2c1e4c2dd2f2c7a811d--vanessa-redgrave-michelangelo-antonioni.jpg,https://www.pinterest.com/pin/565975878181193814/,Blow up (1966) The Seventeen Films That Shaped Tim Gunn
Photos from Celebrities Who Hate the Met Gala - E! Online,https://i.pinimg.com/236x/c7/bc/57/c7bc57ffabcaaa1b6abb999e2d12d5e1--tim-gunn-project-runway.jpg,https://www.pinterest.com/pin/1000995454651845612/,
Tim Gunn Clothing Essentials Are Everything You Need To Build Your Wardrobe | #timgunn #styleguide,https://i.pinimg.com/236x/14/1f/82/141f829f4b554a3e4eb4018777be45c2.jpg,https://www.pinterest.com/pin/156289049558571386/,"One of the most recognizable faces in modern fashion, Tim Gunn is not only a Fashion TV Host full of personality, but a true style icon as well. Know for the phrase 'Make It Work!', the fashion consultant shares his personal essentials to build the most complete and efficient wardrobe; and don't be fooled, none of these items have to be designer! These 10 pieces will offer you complete looks that can go from formal to informal in a second and, most importantly, according to your very own budget!"
25 Confidence-Building Mantras to Write on Your Bathroom Mirror,https://i.pinimg.com/236x/49/34/ef/4934ef29354d1a4647574586e322d5c2--quotes-about-respect-quotes-about-confidence.jpg,https://www.pinterest.com/pin/28569778863099016/,Make It Work
'Sofia the First': Who's Who,https://i.pinimg.com/236x/72/5a/ba/725aba86a3a400166f44b8c26fa4d411.jpg,https://www.pinterest.com/pin/596586281881392560/,'Sofia the First': Who's Who
Tim Gunn | Television Academy,https://i.pinimg.com/236x/3c/26/7a/3c267ae32c34c5945157788950eb0d34--tim-gunn-feel-better.jpg,https://www.pinterest.com/pin/1039979738922361558/,Tim Gunn | Television Academy
'Project Runway': A Season Of Tim Gunn Faces,https://i.pinimg.com/236x/aa/24/ae/aa24ae8e2af3cb960738279f9deed985--tim-gunn-summer-suits.jpg,https://www.pinterest.com/pin/341710690496107515/,"""Where did I leave my plaid glasses? I had them when I left the house, I know that."""
,https://i.pinimg.com/236x/11/d7/b1/11d7b19fbbcd1687335bc4a821dff9e0--role-model-quotes-project-runway.jpg,https://www.pinterest.com/pin/1829656071223667/,Tim Gunn's Takeaway EP. 8 #ProjectRunway #MakeItWork
Tim  Gunn  barbie,https://i.pinimg.com/236x/91/ae/e3/91aee30d17b7e23a362e98e5ab7a9a56--tim-gunn-barbie-barbie.jpg,https://www.pinterest.com/pin/289145238547459435/,Tim Gunn Collection For Barbie - Barbie Collector - Pink Label - Doll 1
"Tim Gunn Flips Through Kim Kardashian Selfie Book: ""IQ Is Plummeting""",https://i.pinimg.com/236x/e4/1d/7a/e41d7aa12307192c8d1ef873402c809c--kim-kardashian-selfie-tim-gunn.jpg,https://www.pinterest.com/pin/173318285637156096/,"Tim Gunn Flips Through Kim Kardashian Selfie Book: ""IQ Is Plummeting"" - Us Weekly"
,https://i.pinimg.com/236x/aa/cd/ca/aacdcad5c6ec1272f27ed45e3743d809--tim-gunn-tim-obrien.jpg,https://www.pinterest.com/pin/7529524348268158/,Tim Gunn's Takeaway Ep. 5 #ProjectRunway #MakeItWork
"TIM GUNN: A GUIDE TO QUALITY, TASTE & STYLE – CAPSULE COUTURE",https://i.pinimg.com/236x/fb/41/4d/fb414d8bbce6ed02c2190f9befd0e6b3.jpg,https://www.pinterest.com/pin/46232333677332449/,
,https://i.pinimg.com/236x/d3/be/4a/d3be4aa2ca0e5ae4ffc6b0d3c95e43db--tim-gunn-tim-obrien.jpg,https://www.pinterest.com/pin/31103053651046321/,Tim Gunn
“You Can’t Just Slap Some Fabric Together And Call It A Dress”: 50 Designs So Bad They Deserved To Be Shamed In This Facebook Group (New Pics),https://i.pinimg.com/236x/6b/1c/50/6b1c50c68a085bcfe2c353885ee1e529.jpg,https://www.pinterest.com/pin/1063482899489405087/,#boredpanda #USA #facebook #shorts #videos #reels #video #shortvideos #instareels #instashorts #facebookshorts #facebookvideos #instagram #youtube #twitter #tiktok #love #instagood #follow #like #socialmedia #whatsapp #music #google #photography #marketing #USA #memes #followforfollowback #likeforlikes #insta #trending #fashion #digitalmarketing #viral #socialmediamarketing #art
Tim Gunn Trashed Marie Kondo And I Kind Of Love It,https://i.pinimg.com/236x/68/7f/29/687f29081fd5e635696d6d027e740e86.jpg,https://www.pinterest.com/pin/52002570686506766/,"“This whole business of 'sparking joy.' I have a huge number of books, do they ALL spark joy? Roget’s Thesaurus does not spark joy. Am I going to get rid of it? NO.” Tim Gunn Trashed Marie Kondo And I Kind Of Love It"
,https://i.pinimg.com/236x/d4/03/06/d40306debb0a3d3b757a5b4b2aa51bc9--tim-gunn-tim-obrien.jpg,https://www.pinterest.com/pin/43980533850320716/,
Tim Gunn From Project Runway,https://i.pinimg.com/236x/d2/ad/f6/d2adf618784f61c52d8d7857c8727798--project-runway-season--fashion-project.jpg,https://www.pinterest.com/pin/483503709977618738/,Pin for Later: Keep It Real This Halloween With the 34 Best Reality TV Costumes Tim Gunn From Project Runway
,https://i.pinimg.com/236x/08/ba/d5/08bad5991f9c8293272dcfb9e2e30406--world-of-fashion-fashion-books.jpg,https://www.pinterest.com/pin/1829656071223672/,Tim Gunn's Takeaway Ep. 12 #ProjectRunway #MakeItWork #Fashion #Quotes
,https://i.pinimg.com/236x/78/f9/bb/78f9bbdd3498f234c4a767ecf50b8f42--speed-reading-tim-gunn.jpg,https://www.pinterest.com/pin/6403624451297377/,Tim Gunn quote on success and the role of the teacher
38 Things You Need If You Want To Be Stylish But Don't Know How,https://i.pinimg.com/236x/21/1b/b3/211bb324c89c423d799ff9d131d4d7d3.jpg,https://www.pinterest.com/pin/355432595589466002/,*Posts OOTD* *Waits to hear from Tim Gunn*
,https://i.pinimg.com/236x/21/81/1f/21811f31257b92c72cf0b7a9bf9768fd--gun-quotes-tim-gunn.jpg,https://www.pinterest.com/pin/31806741088670615/,"just had to include him on this board...see, he is even applauding my choices :)"
Tim Gunn Saw J. Edgar Hoover Cross-Dress,https://i.pinimg.com/236x/51/29/38/51293893522f7c2148bce8147a99a22b--tim-gunn-hoovers.jpg,https://www.pinterest.com/pin/298363544044079198/,Tim Gunn Saw J. Edgar Hoover Cross-Dress
Tim Gunn | favorite words | Pinterest,https://i.pinimg.com/236x/9a/bb/b1/9abbb196e6a466d2c6d7fd96c91ca24f.jpg,https://www.pinterest.com/pin/458522805811332477/,Tim Gunn Tim Gunn
,https://i.pinimg.com/236x/65/3b/71/653b71cdcbb0ca95f446d7046b53efb1--tim-gunn-random-quotes.jpg,https://www.pinterest.com/pin/121175046199103815/,Tim Gunn
"Tim Gunn is having a royal ball voicing Baileywick on Disney Junior’s hit series, “Sofia the First”",https://i.pinimg.com/236x/81/81/b2/8181b28745bc4ed1c65bece6531433a1--tim-gunn-disney-junior.jpg,https://www.pinterest.com/pin/731483164488076695/,
Q & A with Tim Gunn,https://i.pinimg.com/236x/90/75/85/9075853620bbfaca3238bdd49fc642b4--tim-gunn-project-runway.jpg,https://www.pinterest.com/pin/134756213820503406/,Love love him- Tim Gunn!
Tim Gunn: The Obama Girls Are The 'Antidote' To The Kardashians,https://i.pinimg.com/236x/19/22/21/19222105bfb864d305b34f47e0d9fa57--obama-daughter-first-daughter.jpg,https://www.pinterest.com/pin/348888302383481592/,Tim Gunn: The Obama Girls Are The 'Antidote' To The Kardashians
Tim Gunn,https://i.pinimg.com/236x/20/74/04/20740489926e7c8699af7cc6ca63f1f6--tim-gunn-celebrity-list.jpg,https://www.pinterest.com/pin/78953799701809433/,"Now a veteran design consultant and seasoned expert in the fashion industry, Tim Gunn first shot to fame in 2004 as a mentor to contestants on Bravo TV’s popular fashion design competition, Project Ru"
,https://i.pinimg.com/236x/87/52/87/875287585a0e00eeb697d982048b46ef--thats-hilarious-so-funny.jpg,https://www.pinterest.com/pin/914862409416972/,The sass... the sass is real...
I Get My Best Parenting Advice From Tim Gunn,https://i.pinimg.com/236x/5c/bb/6e/5cbb6e84bed417497b8b2f44af430856--tim-gunn-bakersfield.jpg,https://www.pinterest.com/pin/433893745364852104/,
Gabourey Sidibe - Wikipedia,https://i.pinimg.com/236x/29/cd/a4/29cda45cd0e1016683cca0cc92ca8ef9.jpg,https://www.pinterest.com/pin/1140677411841492281/,Gabourey Sidibe - Wikipedia
"15 Tim Gunn Quotes That Are Better Than ""Carry On!""",https://i.pinimg.com/236x/03/20/2f/03202fcd93b6ac61d9c7704c9ca08272--time-on-tim-obrien.jpg,https://www.pinterest.com/pin/537617274252156044/,"Tim Gunn Birthday, Best Quotes Moments Project Runway | Tim Gunn, mentor and fashion guru, turns 63 today. We're looking back at some of his best quotes from his time on the legendary Project Runway. #refinery29 http://www.refinery29.com/2016/07/118280/tim-gunn-best-quotes"
,https://i.pinimg.com/236x/c1/d3/d7/c1d3d755fb3473a9c297809928627e64--becoming-minimalist-minimalist-living.jpg,https://www.pinterest.com/pin/68732640447/,"Your home is living space, not storage space. - missminimalist.com, via becoming minimalist on fb"
,https://i.pinimg.com/236x/ac/7d/55/ac7d55c2a3c538040d6df0ff0895e329--tim-gunn-lunch-quotes.jpg,https://www.pinterest.com/pin/42362052729222159/,Tim Gunn
,https://i.pinimg.com/236x/70/36/19/70361916f0bd7f1ff7ec326cef6135e7.jpg,https://www.pinterest.com/pin/813603488930510443/,
'Project Runway's' Tim Gunn 'never expected to even be on air',https://i.pinimg.com/236x/f3/9d/75/f39d757f008d5d807786672850c60fa5--guest-speakers-tim-gunn.jpg,https://www.pinterest.com/pin/60446819988816006/,'Project Runway's' Tim Gunn 'never expected to even be on air'
Make It Work Pop Tv GIF by Nightcap - Find & Share on GIPHY,https://i.pinimg.com/236x/bb/57/04/bb5704ea9075b685a69c148f55c9ce67--tim-gunn-project-runway.jpg,https://www.pinterest.com/pin/467881848779797891/,New party member! Tags: great project runway poptv pop tv tim gunn nightcap make it work
Tim Gunn rekindled his love for teaching by becoming the oldest student at the fencing school,https://i.pinimg.com/236x/4c/fb/b5/4cfbb53fd125d4dfbc08999d91071bb3--tim-gunn-project-runway.jpg,https://www.pinterest.com/pin/463096774165970369/,Tim Gunn rekindled his love for teaching by becoming the oldest student at the fencing school
So You Have A Job Interview...Now What? - The Speech Bubble SLP,https://i.pinimg.com/236x/82/0c/79/820c7916d7492d00a805b81a11caec31--tim-gunn-project-runway.jpg,https://www.pinterest.com/pin/336784878374540106/,So You Have A Job Interview...Now What?
22 Inspirational Posters You Might Actually Be Inspired By,https://i.pinimg.com/236x/64/b6/34/64b6341c676aed21995667a930cc4abe--book-quotes-words-quotes.jpg,https://www.pinterest.com/pin/302585668687899956/,tim gunn quotes | Love. Tim. Gunn.
Fashion Plates,https://i.pinimg.com/236x/f9/3d/96/f93d962264e2b017510f24c52d82bf59--fashion-designer-designer-toys.jpg,https://www.pinterest.com/pin/556827941440642345/,I could have been Tim Gunn
"Library Lessons: Aug 21-21, 2017",https://i.pinimg.com/236x/53/97/3f/53973ff03a07882755b4ad27c346674d.jpg,https://www.pinterest.com/pin/1012254453733321867/,
9 Reasons Why Tim Gunn Is More Articulate Than You,https://i.pinimg.com/236x/23/35/aa/2335aa28cdbfd8fbdf8c7654dac08060--tim-gunn-project-runway.jpg,https://www.pinterest.com/pin/420382946441373526/,9 Reasons Why Tim Gunn Is More Articulate Than You
Project Runway teens not allowed to redesign Senate Page uniforms,https://i.pinimg.com/236x/e0/06/26/e00626dfb08f8892a10242da3986cd96--tim-gunn-pop-up-shops.jpg,https://www.pinterest.com/pin/463096774165971540/,Rising star: Peytie can be seen posing with Tim at the Lands' End holiday pop up shop in N...
Tim Gunn Talks Supply Chain Transparency in Fashion,https://i.pinimg.com/236x/4a/58/e9/4a58e9e11bd2c24308280a0b28f64122--tim-gunn-supply-chain.jpg,https://www.pinterest.com/pin/463096774165971367/,Tim Gunn Talks Supply Chain Transparency in Fashion
"Reality TV news, information, episode summaries, recaps, message boards, chat, and games for reality TV shows",https://i.pinimg.com/236x/82/23/a4/8223a48f1884ba4677d3a900c5723b67.jpg,https://www.pinterest.com/pin/507429083021605205/,'How I Met Your Mother' alum Josh Radnor releases new song 'You Feel New' #JoshRadnor #HowIMetYourMother
21 Tim Gunn Reactions That Perfectly Sum Up Life As A Gay Twentysomething,https://i.pinimg.com/236x/92/da/e7/92dae79fd9e7f5204ac854ca1885520a--tim-gunn-tim-obrien.jpg,https://www.pinterest.com/pin/216313588329747323/,21 Tim Gunn Reactions That Perfectly Sum Up Life As A Gay Twentysomething
Is it Ever Stylish to Wear Transitions Glasses?,https://i.pinimg.com/236x/f4/99/4c/f4994c6d049cc380eaaf9cab38a7626b.jpg,https://www.pinterest.com/pin/450360031491453986/,Can Transition Lenses Ever Be Cool - Tim Gunn Talks Transition Lenses
Style Advice and Shocking Revelations from Tim Gunn,https://i.pinimg.com/236x/20/97/98/209798c4d73e8d031d1f025ac10327b9--tim-gunn-the-dinner.jpg,https://www.pinterest.com/pin/131378514103439835/,Style Advice and Shocking Revelations from Tim Gunn | The Dinner Party
,https://i.pinimg.com/236x/1d/29/7b/1d297b491a08b92ed5216b37f882045a.jpg,https://www.pinterest.com/pin/306104105931034492/,
"Tim Gunn sez   ""make it work""",https://i.pinimg.com/236x/50/b1/bb/50b1bb87c0787eba11afdc0a2abbb267.jpg,https://www.pinterest.com/pin/857583954041286255/,"Tim Gunn sez ""make it work"""
PSY 104: Week 4 Quiz. Score 25 Out of 25 Correct,https://i.pinimg.com/236x/b3/40/c4/b340c4d365adeeb4ab41d7db8c1cff21.jpg,https://www.pinterest.com/pin/922323198769719464/,Week 4 Quiz 25 Out of 25 Questions Correct
"User Media - TinyPic - Free Image Hosting, Photo Sharing & Video Hosting",https://i.pinimg.com/236x/5c/77/76/5c7776b4e289074c88bc68c80974d868--gif-photo-tumblr-posts.jpg,https://www.pinterest.com/pin/339388521894555160/,Tim Gunn
"Famous birthdays for July 29: Martina McBride, Tim Gunn, Dak Prescott, Josh Radnor, Wil Wheaton, Peter Jennings, Ken Burns, Elizabeth Dole",https://i.pinimg.com/236x/56/e5/66/56e5669d9be421d7143ae924cabb9780.jpg,https://www.pinterest.com/pin/299419075239125380/,Famous birthdays for July 29: Martina McBride Dak Prescott #TimGunn #MartinaMcBride #JoshRadnor #PeterJennings
Best 67 Jenny Humphrey Quotes - Gossip Girl - NSF - Magazine,https://i.pinimg.com/236x/ed/56/b5/ed56b5e9515c04f67eb937c1d289ea8a.jpg,https://www.pinterest.com/pin/1096415471760664352/,
